<?xml version="1.0" encoding="UTF-8" standalone="no"?><beszallitasi_rendszer xmlns:xsi="http://www.w3.org/2001/XMLSchema-instance" xsi:noNamespaceSchemaLocation="./XMLSchemaE8HZ8D.xsd">
    
    <beszallito adoszam="11111111-2-33">
        <cegnev>SnowBoardStuff Bt.</cegnev>
        <cim>
            <zip>3535</zip>
            <varos>Miskolc</varos>
            <utca>Petofi ut</utca>
            <hazszam>13</hazszam>
        </cim>
        <telefonszam>06706027422</telefonszam>
        <telefonszam>06306027422</telefonszam>
    </beszallito>
    <beszallito adoszam="11111111-3-44">
        <cegnev>Kerekgyarto es Tarsa Zrt.</cegnev>
        <cim>
            <zip>2344</zip>
            <varos>Domsod</varos>
            <utca>Kossuth Lajos utca</utca>
            <hazszam>2</hazszam>
        </cim>
        <telefonszam>06206662710</telefonszam>
    </beszallito>
    <beszallito adoszam="11111111-3-35">
        <cegnev>We Sell SnwBrds Zrt.</cegnev>
        <cim>
            <zip>3341</zip>
            <varos>Szucs</varos>
            <utca>Kiraly utca</utca>
            <hazszam>54</hazszam>
        </cim>
        <telefonszam>06708899112</telefonszam>
    </beszallito>

    <szallitja beszallito="11111111-2-33" termek="111222333">
        <szallitasi_ido>3 nap</szallitasi_ido>
        <szallitasi_dij>3000 Ft</szallitasi_dij>
    </szallitja>
    <szallitja beszallito="11111111-2-33" termek="111222444">
        <szallitasi_ido>2 nap</szallitasi_ido>
        <szallitasi_dij>4000 Ft</szallitasi_dij>
    </szallitja>
    <szallitja beszallito="11111111-3-35" termek="111222555">
        <szallitasi_ido>5 nap</szallitasi_ido>
        <szallitasi_dij>1000 Ft</szallitasi_dij>
    </szallitja>

    <snowboard_felszereles azonosito="111222333">
        <tipus>Deszka</tipus>
        <marka>Nitro</marka>
        <nev>Team 159</nev>
        <keszlet>24</keszlet>
        <szarmazasi_hely>Ausztria</szarmazasi_hely>
        <ar>60000</ar>
    </snowboard_felszereles>
    <snowboard_felszereles azonosito="111222444">
        <tipus>Bakancs</tipus>
        <marka>Burton</marka>
        <nev>Moto BOA</nev>
        <keszlet>12</keszlet>
        <ar>50000</ar>
    </snowboard_felszereles>
    <snowboard_felszereles azonosito="111222555">
        <tipus>Kotes</tipus>
        <marka>Ride</marka>
        <nev>Rodeo</nev>
        <keszlet>8</keszlet>
        <szarmazasi_hely>USA</szarmazasi_hely>
        <ar>49000</ar>
    </snowboard_felszereles>

    <viszontelado adoszam="11111111-9-13">
        <cegnev>Snowboard Shop</cegnev>
        <cim>
            <zip>3508</zip>
            <varos>Miskolc</varos>
            <utca>Testvervarosok utja</utca>
            <hazszam>22</hazszam>
        </cim>
        <telefonszam>06706110100</telefonszam>
        <telefonszam>06206110100</telefonszam>
    </viszontelado>
    <viszontelado adoszam="11112222-2-33">
        <cegnev>Snowboards and CO.</cegnev>
        <cim>
            <zip>3521</zip>
            <varos>Miskolc</varos>
            <utca>Arpad ut</utca>
            <hazszam>56</hazszam>
        </cim>
        <telefonszam>06709856734</telefonszam>
    </viszontelado>
    <viszontelado adoszam="11113333-2-33">
        <cegnev>SnowboardStuff</cegnev>
        <cim>
            <zip>3522</zip>
            <varos>Miskolc</varos>
            <utca>Karolyi utca</utca>
            <hazszam>35</hazszam>
        </cim>
        <telefonszam>06208417632</telefonszam>
    </viszontelado>

    <rendeles rendeles_id="aaa111" termek="111222555" viszontelado="11111111-9-13">
        <datum>2021-09-15</datum>
        <mennyiseg>2</mennyiseg>
    </rendeles>
    <rendeles rendeles_id="aaa222" termek="111222444" viszontelado="11112222-2-33">
        <datum>2021-10-22</datum>
        <mennyiseg>2</mennyiseg>
    </rendeles>
    <rendeles rendeles_id="aaa333" termek="111222555" viszontelado="11113333-2-33">
        <datum>2021-11-09</datum>
        <mennyiseg>3</mennyiseg>
    </rendeles>

</beszallitasi_rendszer>